name,purpose,data_exposure,region,attestation
Supabase,"Postgres database, row-level security, object storage","All client records — encrypted at rest, RLS-isolated",US,SOC 2 Type II
Clerk,"Identity provider — authentication, MFA, and organization/user management","User identity and session data (names, emails, auth tokens); no client business records",US,SOC 2 Type II
Render,"Compute service hosting (valuation, report and PDF rendering, webhooks)","Transient request/response only; no client data stored at rest",US,SOC 2 Type II
Vercel,"Static frontend hosting (Vite single-page app)","Serves the browser app; no client data at rest (transient request/response)",US,SOC 2 Type II
Stripe,"Subscription billing and payments for advisor firms","Firm billing and payment data; no client assessment records",US,"PCI DSS Level 1; SOC 2 Type II"
Anthropic,"AI narrative drafted from already-structured data","Report inputs only; never trains on data; never computes or influences a score",US,SOC 2 Type II
